question,answers,topic,sub_topic,follow_ups
"Can you explain the concept of a ""topic"" in the context of topic modeling and how it is identified from text?","A ""topic"" refers to a cluster of words that frequently co-occur in a collection of texts, representing a theme or subject.
Topics are identified through algorithms that analyze word distributions and patterns within the text data.
Latent Dirichlet Allocation (LDA) is a common statistical method used for uncovering topics in a corpus.
The algorithm assigns probabilities to words belonging to each topic based on co-occurrence in documents.
Preprocessing steps like tokenization, stop-word removal, and stemming enhance topic identification accuracy.
Each topic is usually characterized by a set of representative keywords that capture its essence.
Inter-topic correlations can provide insights into how different topics may relate to one another.
Evaluation metrics such as coherence score and silhouette score help assess the quality of identified topics.",natural language processing,Topic Modeling,"How would you differentiate between a topic and a keyword in topic modeling?
Can you provide an example of how a topic model identifies themes in a specific dataset you've worked with?
What techniques or algorithms do you prefer for identifying topics, and why?
How do you handle ambiguity or overlapping topics in your analysis?
Can you discuss the role of parameters, such as the number of topics, in shaping the outcome of your topic modeling?
How do you validate the coherence and relevance of the identified topics?
What challenges have you faced when interpreting the topics generated by your models?
Can you describe a scenario where identified topics were unexpected or counterintuitive, and how you dealt with that?
How might the context of the text influence the topics that are identified?
Have you integrated any visualizations to represent identified topics, and if so, what methods did you use?"
What factors do you consider when choosing the right algorithm for topic modeling?,"Understanding the nature and size of the dataset
Identifying the specific goals of the topic modeling task
Considering the interpretability and explainability of results
Evaluating the scalability of the algorithm for larger datasets
Assessing the computational efficiency and resource requirements
Examining the ability to incorporate domain knowledge
Reviewing the handling of synonyms and polysemy in text
Exploring the flexibility to adjust parameters and model complexity",natural language processing,Topic Modeling,"What specific characteristics of your dataset influence your algorithm choice?
Can you describe a situation where an unexpected factor led you to choose a different algorithm?
How do you assess the trade-offs between interpretability and performance when selecting an algorithm?
What role does the size of the dataset play in your decision-making process for algorithm selection?
How do you evaluate the effectiveness of the algorithm you choose for topic modeling?
Can you provide an example of a project where the chosen algorithm significantly impacted the outcomes or insights gained?
How do computational resources affect your choice of algorithm for topic modeling?
What methods do you use to pre-process your data before selecting an algorithm, and how do they influence your choice?
What features or capabilities do you prioritize in algorithms when dealing with multilingual datasets?
How do you incorporate feedback from domain experts in the context of your algorithm selection process for topic modeling?"
How do you think pre-processing text data influences the effectiveness of topic modeling?,"Pre-processing text data is crucial for improving the quality of topic modeling results
It involves cleaning the text by removing noise such as punctuation, special characters, and stop words
Tokenization helps in breaking down the text into meaningful words or phrases
Stemming and lemmatization reduce words to their base or root form, enhancing consistency
Ensuring proper normalization of text, including case normalization, aids in reducing redundancy
Choosing the right vectorization method, such as TF-IDF or Count Vectorization, impacts model performance
Dimensionality reduction techniques can help in mitigating the curse of dimensionality and improving interpretability
Overall, thorough pre-processing leads to more coherent and meaningful topics being identified in the analysis",natural language processing,Topic Modeling,"What specific pre-processing techniques have you found to be most effective for improving topic modeling outcomes?
Can you provide an example of a project where your pre-processing choices significantly impacted the results of the topic modeling?
How do you decide what type of noise to remove from the text data during the pre-processing stage?
In your experience, how does the choice of tokenization method affect the quality of the topics generated?
Could you discuss the role of stop-word removal in topic modeling and whether you believe it is always necessary?
Have you encountered any challenges in balancing between overly aggressive pre-processing and retaining meaningful data? Can you elaborate?
What approaches do you use to handle synonyms or polysemy during pre-processing, and how do these choices influence topic modeling results?
How do you evaluate the effectiveness of your pre-processing steps before diving into topic modeling?
Can you share any specific metrics or techniques you use to assess the impact of your pre-processing on topic coherence?
What strategies do you employ to pre-process specialized or domain-specific texts, and how does this affect the topic modeling process?"
What role do you believe feature extraction plays in the topic modeling process?,"Define feature extraction and its importance in transforming raw text data into a usable format for analysis
Explain how feature extraction identifies the most relevant terms or phrases that represent underlying topics
Discuss the significance of dimensionality reduction techniques like TF-IDF or word embeddings in feature extraction
Highlight the impact of feature selection on improving model performance and interpretability
Address how feature extraction enables the integration of domain-specific knowledge into topic modeling
Emphasize the role of preprocessing steps, such as tokenization and stop-word removal, in effective feature extraction
Mention potential challenges in feature extraction, such as handling ambiguity and polysemy in natural language
Conclude with the relationship between feature extraction quality and the accuracy of the resulting topic models",natural language processing,Topic Modeling,"Can you elaborate on the specific techniques you use for feature extraction in topic modeling?
How do you determine which features are most relevant for your topic modeling tasks?
What challenges have you encountered with feature extraction, and how did you address them?
Can you provide an example of a project where your choice of features significantly impacted the results of topic modeling?
In your experience, how does the choice of feature extraction method influence the coherence of the topics generated?
How do you handle the dimensionality of features during the extraction process?
What role do you think preprocessing (like tokenization or normalization) plays in feature extraction for topic modeling?
Have you experimented with different feature extraction techniques? If so, what were your findings?
How do you ensure that your extracted features capture the nuances of the text data you're working with?
Can you discuss any tools or libraries you prefer for feature extraction in topic modeling and why?"
How do you evaluate the performance and validity of topic models?,"Define clear evaluation metrics such as coherence, perplexity, and silhouette score
Discuss the importance of human interpretability and qualitative assessment of the topics
Emphasize the use of held-out data to assess generalization of the model
Highlight the role of visualization techniques to understand topic distribution and relationships
Consider comparing against baseline models or established benchmarks for performance
Mention the iterative process of refining models based on evaluation outcomes
Address the significance of domain relevance in evaluating topic quality and applicability
Include the need for reproducibility and consistent results across different runs of the model",natural language processing,Topic Modeling,"What specific metrics or techniques do you use to assess the coherence of topics generated by your models?
Can you provide examples of how you've applied human judgment in evaluating the quality of the topics?
How do you ensure that the topics generated are not only statistically valid but also meaningful in the context of the data?
What challenges have you encountered in validating topic models, and how did you address them?
Have you compared the performance of different topic modeling algorithms in your evaluations? If so, what were the criteria for your comparisons?
In your experience, how important is domain knowledge in evaluating the relevance of the topics produced by a model?
How do you incorporate feedback from stakeholders in the evaluation process of your topic models?
Can you discuss any real-world applications where the evaluation of topic models influenced the outcome of a project?
What role does interpretability play in your evaluation process, and how do you achieve it?
How do you handle situations where the topic model produces ambiguous or overlapping topics?"
What ethical considerations do you think should be taken into account when applying topic modeling to sensitive texts?,"Consider the potential for bias in the data and how it may affect topic extraction
Assess the impact of misrepresentation of sensitive topics on affected communities
Ensure transparency in the methodology used for topic modeling
Prioritize confidentiality and privacy of individuals mentioned in the texts
Be cautious about the interpretation of topics and the conclusions drawn
Evaluate the consequences of labeling or characterizing sensitive content
Involve stakeholders from relevant communities in the modeling process
Adhere to ethical guidelines and best practices in data science and NLP",natural language processing,Topic Modeling,"What specific types of sensitive texts are you referring to, and why do you consider them sensitive?
Can you elaborate on how confidentiality and privacy concerns may influence your approach to topic modeling in these texts?
Have you encountered any ethical dilemmas in your experience with topic modeling, and how did you address them?
In what ways do you ensure that the results of topic modeling do not reinforce biases present in the data?
Can you provide examples of how unintended consequences might arise from applying topic modeling to sensitive content?
How do you think the potential impact on affected individuals should shape the methodology you employ in topic modeling?
What steps do you take to communicate the findings from topic modeling responsibly, especially when dealing with sensitive topics?
How do you balance the need for insight and analysis against the potential harm that your findings might cause in sensitive contexts?"
How do you envision the future of topic modeling evolving with advancements in artificial intelligence?,"Emergence of more sophisticated algorithms that improve accuracy and context understanding
Integration of deep learning techniques to enhance semantic representation of topics
Incorporation of unsupervised and semi-supervised learning to refine topic generation
Development of real-time topic modeling capabilities for dynamic data streams
Greater emphasis on interpretability and explainability of generated topics
Increased use of multimodal inputs to enrich context and diversity of topics
Enhanced collaboration between topic modeling and other AI fields, such as sentiment analysis
Focus on ethical considerations and bias reduction in topic modeling applications",natural language processing,Topic Modeling,"What specific advancements in artificial intelligence do you believe will have the most significant impact on topic modeling?
Can you provide examples of current limitations in topic modeling that you think future AI developments might address?
How do you see the role of unsupervised learning evolving in the context of topic modeling as AI progresses?
In what ways do you think user interpretation of topic models will change as AI technology advances?
How might the integration of other AI techniques, such as deep learning, enhance the effectiveness of topic modeling?
Could you discuss potential ethical implications or challenges that may arise with advancements in topic modeling technologies?
How do you foresee the balance between interpretability and complexity changing in future topic modeling methodologies?
What industries or applications do you think will benefit the most from advancements in topic modeling techniques, and why?"
What advice would you give to someone just starting with topic modeling who feels overwhelmed by the concepts?,"Start by understanding the basic concepts of natural language processing and how they relate to topic modeling
Familiarize yourself with common algorithms used in topic modeling, such as LDA and NMF
Explore introductory tutorials and online courses that offer hands-on practice
Break down the topic modeling process into manageable steps to avoid feeling overwhelmed
Experiment with small datasets to apply what you've learned without the pressure of larger projects
Utilize visualization tools to better grasp the output of topic models and their implications
Join online communities or forums to seek guidance and share experiences with others
Practice patience and persistence, as mastery of topic modeling takes time and experimentation",natural language processing,Topic Modeling,"What specific concepts or techniques in topic modeling do you find most challenging to understand?
Can you describe any particular resources or materials you found helpful when learning about topic modeling?
How do you approach selecting and preprocessing your data for topic modeling?
What common pitfalls or mistakes should beginners be aware of in topic modeling?
Can you share an example of a project where topic modeling significantly enhanced your understanding of the data?
How do you evaluate the results of your topic modeling to ensure they are meaningful and accurate?
What steps do you take to iteratively refine your models once you've established initial topics?
What role do you think parameter tuning plays in the effectiveness of topic modeling?
How do factors like the nature of the text and the intended outcome influence your choice of topic modeling technique?
Can you discuss how you handle challenges related to data sparsity or noise in topic modeling?"
In what ways do you think collaboration with domain experts can enhance the outcomes of topic modeling projects?,"Collaboration with domain experts ensures alignment between the topic modeling goals and the specific needs of the industry.
Domain experts provide critical insights into terminology and context, improving the accuracy of topic identification.
They can guide the selection of relevant datasets, enhancing the quality and relevance of input data for the model.
Expert feedback during the model evaluation phase can lead to better interpretation and refinement of topics generated.
Collaboration fosters a deeper understanding of the subject matter, which can inform feature engineering and modeling approaches.
Domain experts can help validate the results, ensuring that identified topics are meaningful and actionable.
They facilitate interdisciplinary communication, bridging the gap between technical and non-technical stakeholders.
Their involvement can also drive the adoption of results, as they can advocate for findings within their organizations.",natural language processing,Topic Modeling,"Can you provide an example of a project where collaboration with domain experts significantly influenced the results of your topic modeling?
What specific insights or knowledge do you believe domain experts contribute that may not be readily apparent from the data alone?
How do you facilitate communication between your team and the domain experts during the topic modeling process?
In your experience, what challenges have you encountered when working with domain experts on topic modeling, and how did you overcome them?
Can you discuss any particular methodologies or frameworks you've adopted to integrate the input from domain experts into your topic modeling workflow?
How do you ensure that the perspectives of domain experts align with the goals of the topic modeling project?
Have you noticed any differences in outcomes when collaborating with experts from different fields or industries? If so, can you describe those differences?
How do you evaluate the effectiveness of the collaboration with domain experts throughout the topic modeling process?
What role do domain experts play in the interpretation and validation of the topics generated by your models?
How do you handle conflicting interpretations or priorities between the data-driven insights and the domain experts’ knowledge?"
How do you approach troubleshooting when your topic modeling results do not align with your expectations?,"Assess the quality of the input data for inconsistencies or biases
Review the preprocessing steps taken, such as tokenization and stopword removal
Examine the choice of topic modeling algorithm and its suitability for the dataset
Adjust hyperparameters and evaluate their impact on the results
Investigate the number of topics specified and consider if it aligns with the data
Utilize domain knowledge to interpret topics and identify misalignments
Visualize the topics and associated terms to identify potential misleading results
Conduct iterative testing and validation to refine the model and improve output",natural language processing,Topic Modeling,"Can you describe a specific instance where the topic modeling results were unexpected?
What techniques do you use to evaluate the quality of the topics generated?
Have you ever adjusted your preprocessing steps? If so, what changes did you implement and why?
How do you determine if a topic model is overfitting or underfitting the data?
What role does feature selection play in your troubleshooting process?
Can you provide examples of adjustments you've made to hyperparameters during troubleshooting?
How do you incorporate domain knowledge to refine your topic modeling results?
Have you utilized any visualization tools during your troubleshooting process? What insights did they provide?
What steps do you take to ensure that your topic modeling is interpretable and actionable for stakeholders?
How do you handle ambiguity in topic labeling during your troubleshooting?"
What impact do you believe topic modeling could have on social media analysis and understanding public sentiment?,"clear explanation of topic modeling and its relevance to social media analysis
discussion of how topic modeling can identify emerging trends and themes in conversations
insight into improving content categorization and enhancing user experience on platforms
analysis of sentiment distribution across identified topics to gauge public opinion
explanation of how topic modeling can support brand monitoring and competitive analysis
consideration of challenges in accurately interpreting context and sentiment
real-world examples of successful applications in current social media strategies
awareness of ethical considerations and data privacy issues in topic modeling applications",natural language processing,Topic Modeling,"How do you think topic modeling can enhance sentiment analysis specifically on social media platforms?
Can you provide an example of a situation where topic modeling significantly changed the interpretation of social media sentiment?
What challenges do you foresee in applying topic modeling to social media data, and how might you address them?
In your experience, how does the diversity of topics identified through modeling affect the overall understanding of public sentiment?
How might the findings from topic modeling influence strategies for brand management or communication in social media contexts?
Could you elaborate on the preprocessing steps you would consider crucial for improving the accuracy of topic modeling in analyzing social media content?
How would you integrate topic modeling results with other data sources to provide a more comprehensive insight into public sentiment?
What tools or frameworks have you found most effective for topic modeling in the context of social media analysis?"
Can you reflect on a learning experience you had while trying to implement topic modeling for the first time?,"described the specific context and objectives of the project
articulated the initial challenges faced during implementation
explained the methods or algorithms chosen for topic modeling
discussed any resources or tools used (e.g., libraries, datasets)
reflected on the learning curve and knowledge gained through the process
highlighted problem-solving strategies employed to overcome obstacles
shared insights on the importance of parameter tuning and evaluation
concluded with the impact of the experience on future projects or applications",natural language processing,Topic Modeling,"What specific challenges did you encounter during the implementation of topic modeling?
How did you overcome those challenges, and what strategies were most effective?
Can you describe a particular moment or realization during this process that significantly enhanced your understanding of topic modeling?
What techniques or tools did you initially choose, and how did you decide on them?
How did the results from your initial implementation compare to your expectations, and what did you learn from that discrepancy?
Can you provide an example of a dataset you used for this implementation and how it influenced your approach?
How did your understanding of data preprocessing affect the topic modeling outcomes?
What additional resources, such as books or online courses, did you find helpful during your learning process?
In what ways has that first experience shaped your approach to topic modeling in subsequent projects?
Did you collaborate with others during this learning experience, and if so, how did that impact your understanding?"
How do you define sentiment analysis in your own words?,"A method to identify and categorize emotions expressed in text
Analyzes language to determine positive, negative, or neutral sentiments
Utilizes techniques from linguistics, machine learning, and statistical modeling
Involves preprocessing text data for tokenization and normalization
Can be applied to various data sources like social media, reviews, and surveys
Often uses sentiment lexicons or pre-trained models for accuracy
Can help businesses understand customer opinions and improve decision-making
May include challenges like sarcasm detection and language ambiguity",natural language processing,Sentiment Analysis,"Can you elaborate on the specific techniques or methodologies you use in sentiment analysis?
What role does data preprocessing play in your approach to sentiment analysis?
How do you handle ambiguous or mixed sentiments in the text you analyze?
Can you provide an example of a project where you applied sentiment analysis and discuss the results?
How do you evaluate the accuracy and effectiveness of your sentiment analysis models?
What challenges have you faced when implementing sentiment analysis, and how did you overcome them?
How do you tailor sentiment analysis techniques for different types of content, such as social media posts versus formal reviews?
In what ways do you think sentiment analysis can be improved or refined in the future?
How do you incorporate domain-specific knowledge into your sentiment analysis models?
What tools or libraries do you prefer for performing sentiment analysis, and why?"
Can you describe a particular project or task where you successfully applied sentiment analysis?,"Clearly define the scope and objectives of the project
Describe the dataset used, including size, source, and features
Explain the tools and techniques employed for sentiment analysis
Discuss the preprocessing steps taken to prepare the data
Share insights or findings derived from the sentiment analysis
Highlight any challenges faced and how they were resolved
Mention the impact of the project on stakeholders or the organization
Reflect on what was learned and how it could inform future projects",natural language processing,Sentiment Analysis,"What specific techniques or tools did you use in the sentiment analysis for that project?
How did you ensure the accuracy and reliability of the sentiment analysis results?
Can you explain the challenges you faced during this project and how you overcame them?
What were the key insights you gained from the sentiment analysis, and how did they influence the project outcomes?
How did you handle ambiguous or mixed sentiments in the data you analyzed?
Can you discuss any preprocessing steps you took before performing sentiment analysis?
What was the size and nature of the dataset you used, and how did it impact your approach?
How did you integrate the sentiment analysis results with other aspects of the project or business objectives?
Can you share any metrics or KPIs you used to evaluate the success of the sentiment analysis in this project?
How did you communicate the findings of the sentiment analysis to stakeholders or team members?"
